owner,repo,number,title,comments,pr,bug,feature,unlabelled,reaction_p1,reaction_other
r-dbi,bigrquery,137,Added support for maximumBillingTier option closes #133,1,TRUE,FALSE,FALSE,FALSE,0,0
r-dbi,bigrquery,126,Function to load a table from Google Cloud Storage object(s)?,3,FALSE,FALSE,TRUE,FALSE,0,0
r-dbi,bigrquery,94,64-bit integers,5,FALSE,FALSE,TRUE,FALSE,0,0
r-dbi,bigrquery,73,Error after first attempt to execute query when permissions have been revoked,3,FALSE,TRUE,FALSE,FALSE,0,0
r-dbi,bigrquery,52,Added db_save_query.bigquery so compute() now works,3,TRUE,FALSE,FALSE,FALSE,0,0
r-dbi,DBI,233,Pass missing value argument to secondary dbWriteTable call,1,TRUE,FALSE,FALSE,FALSE,0,0
r-dbi,DBI,232,"Unable to find an inherited method for function ‘dbReadTable’ for signature ‘""MySQL"", ""missing""",0,FALSE,FALSE,FALSE,TRUE,0,0
r-dbi,DBI,231,Add R Consortium as funder to DESCRIPTION,0,FALSE,FALSE,FALSE,TRUE,0,0
r-dbi,DBI,230,Use evalRd,0,FALSE,FALSE,FALSE,TRUE,0,0
r-dbi,DBI,229,dbWriteTable failing to write with schema on SQL Server,0,FALSE,FALSE,FALSE,TRUE,0,0
r-dbi,DBI,228,Problem with dbWithTransaction ,0,FALSE,FALSE,FALSE,TRUE,0,0
r-dbi,DBI,227,DBI::dbExecute not returning error on maximum size,0,FALSE,FALSE,FALSE,TRUE,0,0
r-dbi,DBI,226,Character encoding in dbSendQuery/dbGetQuery in R,0,FALSE,FALSE,FALSE,TRUE,0,0
r-dbi,DBI,225,Oracle spatial column support,0,FALSE,FALSE,FALSE,TRUE,0,0
r-dbi,DBI,224,Add prefix argument to dbListObject(),0,FALSE,FALSE,FALSE,TRUE,0,0
r-dbi,DBI,221,Suppress codecov reports in PRs,0,FALSE,FALSE,FALSE,TRUE,0,0
r-dbi,DBI,219,Error: Cannot pass NA to dbQuoteIdentifier() dbname is datablock-db,10,FALSE,FALSE,FALSE,TRUE,0,0
r-dbi,DBI,214,Broken Github Link,0,FALSE,FALSE,FALSE,TRUE,0,0
r-dbi,DBI,213,Implement monorepo,2,FALSE,FALSE,FALSE,TRUE,0,0
r-dbi,DBI,211,Implement RStudio Connection Contract,5,FALSE,FALSE,FALSE,TRUE,0,0
r-dbi,DBI,206,Specify binding of different argument types for different calls of dbBind(),0,FALSE,FALSE,FALSE,FALSE,0,0
r-dbi,DBI,204,sqlAppendTable has issues with date time fields,3,FALSE,FALSE,FALSE,TRUE,0,0
r-dbi,DBI,203,Specialised data types in R,3,FALSE,FALSE,FALSE,FALSE,0,0
r-dbi,DBI,197,Think about argument to `dbRemoveTable()` that drops only if the table exists,1,FALSE,FALSE,FALSE,TRUE,0,0
r-dbi,DBI,190,Add generic dbIsReadOnly,6,TRUE,FALSE,FALSE,FALSE,0,0
r-dbi,DBI,189,Implementing `dbIsReadOnly` as part of the DBI interface,2,FALSE,FALSE,FALSE,TRUE,0,0
r-dbi,DBI,177,dbWithConnection() and dbWithResult(),0,FALSE,FALSE,FALSE,FALSE,0,0
r-dbi,DBI,170,Consider new generics from dbplyr,2,FALSE,FALSE,FALSE,FALSE,0,0
r-dbi,DBI,168,Colliding representations of -2³¹ and NA_INTEGER,1,FALSE,FALSE,FALSE,FALSE,0,0
r-dbi,DBI,163,Ensure all backends have a format method?,2,FALSE,FALSE,FALSE,FALSE,0,0
r-dbi,DBI,142,Think about closing a result for reopening it later,0,FALSE,FALSE,FALSE,FALSE,0,0
r-dbi,DBI,141,Think about listing temporary tables,7,FALSE,FALSE,FALSE,FALSE,0,0
r-dbi,DBI,137,Think about column conversion,4,FALSE,FALSE,FALSE,FALSE,0,0
r-dbi,DBI,134,dbGetChunkedQuery(),3,FALSE,FALSE,FALSE,FALSE,0,0
r-dbi,DBI,123,Feature request: implement timeouts for queries,3,FALSE,FALSE,FALSE,TRUE,0,0
r-dbi,DBI,87,dbCanConnect ?,2,FALSE,FALSE,FALSE,FALSE,0,0
r-dbi,DBI,72,Separate packages for handling DB connections and SQL?,2,FALSE,FALSE,FALSE,FALSE,0,0
r-dbi,DBI,62,Think about fast importing,11,FALSE,FALSE,FALSE,TRUE,0,0
r-dbi,DBI,52,Think about ways to specify placeholder in prepared/parametrized query,5,FALSE,FALSE,FALSE,FALSE,0,0
r-dbi,DBItest,162,Test for formals(dbXxx) ineffective,0,FALSE,FALSE,FALSE,TRUE,0,0
r-dbi,DBItest,161,Test roundtrip of long strings and blobs,0,FALSE,FALSE,FALSE,TRUE,0,0
r-dbi,DBItest,160,Test sensible value for dbRowsAffected() after dropping table,0,FALSE,FALSE,FALSE,FALSE,0,0
r-dbi,DBItest,158,Test that result set becomes invalid,0,FALSE,FALSE,FALSE,FALSE,0,0
r-dbi,DBItest,157,Specify and test rejection of invalid queries,3,FALSE,FALSE,FALSE,FALSE,0,0
r-dbi,DBItest,156,Check that functions work with invalid Unicode strings,17,FALSE,FALSE,FALSE,FALSE,0,0
r-dbi,DBItest,155,Specify and test case-sensitivity for table names,0,FALSE,FALSE,FALSE,FALSE,0,0
r-dbi,DBItest,154,Name collision when creating tables,0,FALSE,FALSE,FALSE,FALSE,0,0
r-dbi,DBItest,152,More extensive tests for field.types argument,0,FALSE,FALSE,FALSE,FALSE,0,0
r-dbi,DBItest,151,Prepare CRAN release,4,FALSE,FALSE,FALSE,TRUE,0,0
r-dbi,DBItest,149,Test UTF-8 encoding of dbQuoteString(),0,FALSE,FALSE,FALSE,FALSE,0,0
r-dbi,DBItest,148,Check roundtrip of dates prior to 1970,0,FALSE,FALSE,FALSE,FALSE,0,0
r-dbi,DBItest,146,Writing of 64-bit data,0,FALSE,FALSE,FALSE,FALSE,0,0
r-dbi,DBItest,145,placeholders only allowed in statements if query is prefixed with PREPARE,2,FALSE,FALSE,FALSE,TRUE,0,0
r-dbi,DBItest,144,Add tweak to invalidate connection,0,FALSE,FALSE,FALSE,FALSE,0,0
r-dbi,DBItest,140,Add tweak for restricting to one result set per connection,1,FALSE,FALSE,FALSE,FALSE,0,0
r-dbi,DBItest,139,Spec row.names = FALSE default for dbWriteTable(),0,FALSE,FALSE,FALSE,FALSE,0,0
r-dbi,DBItest,138,Test that named parameters are actually matched by name,0,FALSE,FALSE,FALSE,FALSE,0,0
r-dbi,DBItest,137,Specify behavior for empty or duplicate column names,6,FALSE,FALSE,FALSE,FALSE,0,0
r-dbi,DBItest,133,Test and specify bigint argument to dbConnect(),12,FALSE,FALSE,FALSE,FALSE,0,0
r-dbi,DBItest,132,Invalid SELECT query in SQL Server,1,FALSE,FALSE,FALSE,FALSE,0,0
r-dbi,DBItest,131,`CREATE TABLE AS SELECT` not valid SQL for SQL Server,2,FALSE,FALSE,FALSE,FALSE,0,0
r-dbi,DBItest,128,Documentation tweaks,0,FALSE,FALSE,FALSE,TRUE,0,0
r-dbi,DBItest,127,Specify and test sqlData() and other helpers,0,FALSE,FALSE,FALSE,FALSE,0,0
r-dbi,DBItest,124,Avoid DML in tests,0,FALSE,FALSE,FALSE,FALSE,0,0
r-dbi,DBItest,119,Avoid hard-coded data types in queries,1,FALSE,FALSE,FALSE,FALSE,0,0
r-dbi,DBItest,82,Use enc package for encoding checks,2,FALSE,FALSE,FALSE,FALSE,0,0
r-dbi,DBItest,71,Test MonetDB and MonetDBlite in Travis CI,0,FALSE,FALSE,FALSE,FALSE,0,0
r-dbi,DBItest,64,Identifiers should be quoted,5,FALSE,FALSE,FALSE,FALSE,0,0
r-dbi,DBItest,45,different SQL dialects among DBMS: in test_result: column alias & FROM stmt.),2,FALSE,FALSE,FALSE,FALSE,0,0
r-dbi,odbc,165,dbExistsTable() error using Id() with Oracle,2,FALSE,FALSE,FALSE,FALSE,0,0
r-dbi,odbc,164,"Ability to direct-execute queries, including batches of SQL statements",0,TRUE,FALSE,FALSE,FALSE,0,0
r-dbi,odbc,163,Batches of SQL statements and direct execution,1,FALSE,FALSE,TRUE,FALSE,0,0
r-dbi,odbc,159,Enhanced data types for Teradata connections,0,FALSE,FALSE,TRUE,FALSE,0,0
r-dbi,odbc,158,Provide a way to prevent the Connections pane from loading,3,FALSE,FALSE,TRUE,FALSE,0,0
r-dbi,odbc,150,odd encoding errors with IBM Informix,3,FALSE,TRUE,FALSE,FALSE,0,0
r-dbi,odbc,144,Oracle connectivity,2,FALSE,FALSE,FALSE,FALSE,0,0
r-dbi,odbc,142,"Previewing tables via the connections pane in R Studio Server leads to an ""R Session Error""",6,FALSE,FALSE,TRUE,FALSE,0,0
r-dbi,odbc,134,odbc::odbc() issue with query on Windows machine,1,FALSE,TRUE,FALSE,FALSE,0,0
r-dbi,odbc,133,Allow user to specify the number of rows fetched when binding,0,FALSE,FALSE,TRUE,FALSE,0,0
r-dbi,odbc,130,odbc + mssql - time subseconds are truncated,3,FALSE,FALSE,FALSE,FALSE,0,0
r-dbi,odbc,127,Issue creating local temporary table in SQL Server dB using Select Into SQL statement,4,FALSE,TRUE,FALSE,FALSE,0,0
r-dbi,odbc,126,nvarchar character encoding in nettezza db,11,FALSE,TRUE,FALSE,FALSE,0,0
r-dbi,odbc,108,Column datatype name not returned in dbColumnInfo() ,2,FALSE,FALSE,TRUE,FALSE,0,0
r-dbi,odbc,96,Incomplete error message,14,FALSE,FALSE,FALSE,FALSE,0,0
r-dbi,RKazam,4,Avoid forwarding with getMethod() calls,0,FALSE,FALSE,FALSE,TRUE,0,0
r-dbi,RKazam,3,Include common code for connections and result sets,0,FALSE,FALSE,FALSE,TRUE,0,0
r-dbi,RKazam,2,Create three documentation pages for reexported DBI methods,0,FALSE,FALSE,FALSE,TRUE,0,0
r-dbi,RMariaDB,91,Symbol not found: _mysql_close when install RMariaDB,1,FALSE,FALSE,FALSE,TRUE,0,0
r-dbi,RMariaDB,90,"Error in result_fetch(res@ptr, n) : Error fetching buffer: (but not in RMySQL)",2,FALSE,FALSE,FALSE,TRUE,0,0
r-dbi,RMariaDB,89,Window functions and MariaDB,0,FALSE,FALSE,FALSE,TRUE,0,0
r-dbi,RMariaDB,88,mysql.h not found though it is present at /usr/include/mysql/mysql.h,0,FALSE,FALSE,FALSE,TRUE,0,0
r-dbi,RMariaDB,87,"Cannot bind int64 (Error in result_fetch(res@ptr, n) : Not yet supported )",0,FALSE,FALSE,FALSE,TRUE,0,0
r-dbi,RMariaDB,86,BLOB - RMariaDB vs RMySQL,0,FALSE,FALSE,FALSE,TRUE,0,0
r-dbi,RMariaDB,85,SSL Connection Error: Certificate Verify Failed,1,FALSE,FALSE,FALSE,TRUE,0,0
r-dbi,RMariaDB,84,Selecting TINYINT columns returns a list column,0,FALSE,FALSE,FALSE,TRUE,0,0
r-dbi,RMariaDB,82,Upgrade libmariadbclient on Windows,4,TRUE,FALSE,FALSE,FALSE,0,0
r-dbi,RMariaDB,80,Inconsistent behavior of time zone conversion,10,FALSE,FALSE,FALSE,TRUE,0,0
r-dbi,RMariaDB,79,R session crash when using dbWriteTable,3,FALSE,TRUE,FALSE,FALSE,0,0
r-dbi,RMariaDB,78,Get rid of timegm(),0,FALSE,TRUE,FALSE,FALSE,0,0
r-dbi,RMariaDB,77,handling of NaN is not DBI compliant,5,FALSE,FALSE,FALSE,TRUE,0,0
r-dbi,RMariaDB,76,Unable to find/link libmysqlclient on Amazon Linux,3,FALSE,FALSE,FALSE,TRUE,0,0
r-dbi,RMariaDB,74,will not read .my.cnf on Windows 10,1,FALSE,FALSE,FALSE,TRUE,0,0
r-dbi,RMariaDB,65,Installation fails on macOS when built against mysql-connector-c,13,FALSE,FALSE,FALSE,TRUE,0,0
r-dbi,RMariaDB,63,Reenable DBItest and DBI remote,0,FALSE,FALSE,FALSE,TRUE,0,0
r-dbi,RMariaDB,62,Remove configure warning for Connector/C,0,FALSE,FALSE,FALSE,TRUE,0,0
r-dbi,RMariaDB,32,Internal: Nicer conversion from RcppNullable to API strings,0,FALSE,FALSE,FALSE,TRUE,0,0
r-dbi,RMariaDB,19,Eliminate MyConnectionPtr,0,FALSE,FALSE,FALSE,TRUE,0,0
r-dbi,RMariaDB,11,LOAD DATA LOCAL INFILE vs INSERT INTO,10,FALSE,FALSE,FALSE,TRUE,0,0
r-dbi,RMariaDB,2,Add vignette discussing how to use google cloud sql,0,FALSE,FALSE,FALSE,TRUE,0,0
r-dbi,RMySQL,214,RMySQL fails build with mariadb >10.4,10,FALSE,FALSE,FALSE,TRUE,0,0
r-dbi,RMySQL,213,Rows missing on inserting data frame with large character field,0,FALSE,FALSE,FALSE,TRUE,0,0
r-dbi,RMySQL,212,Implement RStudio Connection Contract,0,FALSE,FALSE,FALSE,TRUE,0,0
r-dbi,RMySQL,211,Installing with Homebrew on OS X Sierra; cannot find RMySQL.so file it just created?,0,FALSE,FALSE,FALSE,TRUE,0,0
r-dbi,RMySQL,210,dbWriteTable fails without row_names column,0,FALSE,FALSE,FALSE,TRUE,0,0
r-dbi,RMySQL,209,Document default database name in the RMySQL::mysqlHasDefault() function,0,FALSE,FALSE,FALSE,TRUE,0,0
r-dbi,RMySQL,205,RMysql encoding utf8 issue,0,FALSE,FALSE,FALSE,FALSE,0,0
r-dbi,RMySQL,204,Query table of many DECIMAL columns causes error in terminal,5,FALSE,FALSE,FALSE,FALSE,0,0
r-dbi,RMySQL,200,dbWriteTable inserts partial data for large data frames ,2,FALSE,FALSE,FALSE,FALSE,0,0
r-dbi,RMySQL,196,First time query often produces error,0,FALSE,FALSE,FALSE,FALSE,0,0
r-dbi,RMySQL,194,dbWriteTable options,4,FALSE,FALSE,FALSE,TRUE,0,0
r-dbi,RMySQL,187,"R abends: dbWriteTable - new table with overwrite=T, append=F",1,FALSE,FALSE,FALSE,TRUE,0,0
r-dbi,RMySQL,183,dbWriteTable into utf-8 MySQL DB from windows,9,FALSE,FALSE,FALSE,FALSE,0,0
r-dbi,RMySQL,181,Can't build on OSX 10.12.3,1,FALSE,FALSE,FALSE,FALSE,0,0
r-dbi,RMySQL,180,could not run statement: The used command is not allowed with this MySQL version,2,FALSE,FALSE,FALSE,TRUE,0,0
r-dbi,RMySQL,179,Very slow SELECT queries,1,FALSE,FALSE,FALSE,FALSE,0,0
r-dbi,RMySQL,177,Failed to connect to database: Error: Access denied for user,2,FALSE,FALSE,FALSE,FALSE,0,0
r-dbi,RMySQL,176,Type warnings on MySQL and dplyr::mutate,0,FALSE,FALSE,FALSE,FALSE,0,0
r-dbi,RMySQL,174,"Connecting to mysqld 5.7 using RMySQL 0.10.9 binaries, weirdness when compiling from source",0,FALSE,FALSE,FALSE,FALSE,0,0
r-dbi,RMySQL,173,Error running sub-queries,0,FALSE,FALSE,FALSE,FALSE,0,0
r-dbi,RMySQL,172,columntoRownames Warning,1,FALSE,FALSE,FALSE,TRUE,0,0
r-dbi,RMySQL,169,Date field of my table not being read correctly from a mysql database inside R,5,FALSE,FALSE,FALSE,TRUE,0,0
r-dbi,RMySQL,168,Bit(1) is read incorrectly,2,FALSE,FALSE,FALSE,FALSE,0,0
r-dbi,RMySQL,166,bigint MySQL data type is returned as numeric,0,FALSE,FALSE,FALSE,FALSE,0,0
r-dbi,RMySQL,164,dbWriteTable error when there are capitalized characters in table name,1,FALSE,FALSE,FALSE,TRUE,0,0
r-dbi,RMySQL,163,could not run statement: Commands out of sync; you can't run this command now,3,FALSE,FALSE,FALSE,TRUE,0,0
r-dbi,RMySQL,162,SSL Connection error,2,FALSE,FALSE,FALSE,FALSE,0,0
r-dbi,RMySQL,161,Install fails under MacPorts R,1,FALSE,FALSE,FALSE,FALSE,0,0
r-dbi,RMySQL,160,dbColumnInfo causes a crash,2,FALSE,FALSE,FALSE,FALSE,0,0
r-dbi,RMySQL,157,all values in a logical column are set to 0,2,FALSE,FALSE,FALSE,FALSE,0,0
r-dbi,RMySQL,154,RMySQL connection without handle Error,4,FALSE,FALSE,FALSE,FALSE,0,0
r-dbi,RMySQL,150,Fix appveyor,3,FALSE,FALSE,FALSE,TRUE,0,0
r-dbi,RMySQL,142,"dbWriteTable(Connection, character, character) not working with dev version of DBI",0,FALSE,FALSE,FALSE,FALSE,0,0
r-dbi,RMySQL,138,Typing name of disconnected connection after running dbUnloadDriver() crashes R on Windows,8,FALSE,FALSE,FALSE,FALSE,0,0
r-dbi,RMySQL,133,dbColumnInfo() should not return factors,0,FALSE,FALSE,FALSE,FALSE,0,0
r-dbi,RMySQL,118,Turkish characters R to MySQL write problem,14,FALSE,FALSE,FALSE,TRUE,0,0
r-dbi,RMySQL,99, libmysqlclient.so.18: cannot open shared object file: No such file or directory ,22,FALSE,FALSE,FALSE,FALSE,0,0
r-dbi,RMySQL,68,Upsert for dbWriteTable,1,FALSE,FALSE,FALSE,TRUE,0,0
r-dbi,RMySQL,66,Dot to underscore conversion in column names,2,FALSE,FALSE,FALSE,FALSE,0,0
r-dbi,RPostgres,179,Cannot use `Id()` with `dbWriteTable()`,0,FALSE,FALSE,FALSE,TRUE,0,0
r-dbi,RPostgres,178,RPostgres appears to not write integer64 to database as long int,0,FALSE,FALSE,FALSE,TRUE,0,0
r-dbi,RPostgres,175,creates error when trying to connect to a different schema,0,FALSE,FALSE,FALSE,TRUE,0,0
r-dbi,RPostgres,174,GSSAPI authentication not supported,0,FALSE,FALSE,FALSE,TRUE,0,0
r-dbi,RPostgres,173,Typname,9,TRUE,FALSE,FALSE,FALSE,0,0
r-dbi,RPostgres,172,Encoding of column names and error messages,0,FALSE,FALSE,FALSE,TRUE,0,0
r-dbi,RPostgres,170,Support for field type citext,0,FALSE,FALSE,FALSE,TRUE,0,0
r-dbi,RPostgres,167,Connection segfault in environment's finalizer,0,FALSE,FALSE,FALSE,TRUE,0,0
r-dbi,RPostgres,166,Minimum PostgreSQL version?,0,FALSE,FALSE,FALSE,TRUE,0,0
r-dbi,RPostgres,164,syntax error when dbWriteTable to Redshift due to lack of quotes,1,FALSE,FALSE,FALSE,TRUE,0,0
r-dbi,RPostgres,162,Doesn't work with different schemas,2,FALSE,FALSE,FALSE,TRUE,0,0
r-dbi,RPostgres,160,dbExistsTable can't handle schema,1,FALSE,FALSE,FALSE,TRUE,0,0
r-dbi,RPostgres,147,Fix roundtrip_timestamp on i386,0,FALSE,FALSE,FALSE,TRUE,0,0
r-dbi,RPostgres,139,libpq expects knowledge about data types for parametrized queries,1,FALSE,FALSE,FALSE,TRUE,0,0
r-dbi,RPostgres,134,foreign tables are not recognised,6,FALSE,FALSE,FALSE,TRUE,0,0
r-dbi,RPostgres,92,dbColumnInfo doesn't match DBI spec,3,FALSE,FALSE,FALSE,TRUE,0,0
r-dbi,RPostgres,35,Support arrays natively,9,FALSE,FALSE,FALSE,TRUE,0,0
r-dbi,RPostgres,13,Savepoint support,1,FALSE,FALSE,FALSE,TRUE,0,0
r-dbi,RSQLite,255,Couldn't set synchronous mode: disk I/O error,0,FALSE,FALSE,FALSE,TRUE,0,0
r-dbi,RSQLite,251,C stack limit error on dbWriteTable when using BayesFactor,3,FALSE,FALSE,FALSE,TRUE,0,0
r-dbi,RSQLite,249,"feature request: allow quote= parameter in dbWriteTable S4 method 'SQLiteConnection,character,character'",0,FALSE,FALSE,FALSE,TRUE,0,0
r-dbi,RSQLite,248,should `RSQLite:::rsqlite_import_file` break if problem row happens beyond extent of desired import?,0,FALSE,FALSE,FALSE,TRUE,0,0
r-dbi,RSQLite,247,Question: ERROR: compilation failed for package RSQLite,2,FALSE,FALSE,FALSE,TRUE,0,0
r-dbi,RSQLite,246,Improve error message when writing dataframe with unsupported data type,0,FALSE,FALSE,FALSE,TRUE,0,0
r-dbi,RSQLite,245,"gc()'ing an unclosed connection signals incorrectly, and aborts (core dumps) an R session",1,FALSE,FALSE,FALSE,TRUE,0,0
r-dbi,RSQLite,242,Include newest version of SQLite,0,FALSE,FALSE,FALSE,TRUE,0,0
r-dbi,RSQLite,239,"dbWriteTable() not working when the ""party"" package is loaded",2,FALSE,FALSE,FALSE,TRUE,0,0
r-dbi,RSQLite,237,Coerce POSIXct to julian date when writing,5,FALSE,FALSE,FALSE,TRUE,0,0
r-dbi,RSQLite,235,max number of columns,1,FALSE,FALSE,FALSE,TRUE,0,0
r-dbi,RSQLite,233,Korean letter encoding error on Windows,2,FALSE,TRUE,FALSE,FALSE,0,0
r-dbi,RSQLite,230,duplicated column names,1,FALSE,FALSE,FALSE,TRUE,0,0
r-dbi,RSQLite,228,Remove implementation of dbListFields(),0,FALSE,FALSE,FALSE,TRUE,0,0
r-dbi,RSQLite,227,dbFetch warning,2,FALSE,FALSE,FALSE,TRUE,0,0
r-dbi,RSQLite,226,Better warning for dbGetQuery() on statement,0,FALSE,FALSE,FALSE,TRUE,0,0
r-dbi,RSQLite,225,(dbplyr): mutate(round) quietly clobbers non-numeric columns ,1,FALSE,FALSE,FALSE,TRUE,0,0
r-dbi,RSQLite,224,Use SQLITE_DISABLE_INTRINSIC,2,TRUE,FALSE,FALSE,FALSE,0,0
r-dbi,RSQLite,223,"cannot install (intel icc icpc compiler issue?): ""package or namespace load failed""",9,FALSE,FALSE,FALSE,TRUE,0,0
r-dbi,RSQLite,218,REGEXP with RSQLite,3,FALSE,FALSE,FALSE,TRUE,0,0
r-dbi,RSQLite,202,Misuse of Suggests,23,FALSE,FALSE,FALSE,TRUE,0,0
r-dbi,RSQLite,199,Allow termination of queries,1,FALSE,FALSE,FALSE,FALSE,0,0
r-dbi,RSQLite,179,Avoid copies when reading/writing blobs,1,FALSE,FALSE,FALSE,FALSE,0,0
r-dbi,RSQLite,167,Consider supporting ICU extension,0,FALSE,FALSE,FALSE,TRUE,0,0
r-dbi,RSQLite,117,dbGetInfo() for driver and connection,4,FALSE,FALSE,FALSE,TRUE,0,0
r-dbi,SQL,7,Why has this been moved to DBI?,1,FALSE,FALSE,FALSE,TRUE,0,0
r-dbi,SQL,6,Compiler warnings,2,FALSE,FALSE,FALSE,TRUE,0,0
r-dbi,SQL,5,Appropriately serialize list of raw vectors ,0,FALSE,FALSE,FALSE,TRUE,0,0
hadley,emo,41,ji_rx does not cover non fully qualified emojis,0,FALSE,FALSE,FALSE,TRUE,0,0
hadley,emo,39,Two new functions perhaps?,0,FALSE,FALSE,FALSE,TRUE,0,0
hadley,emo,38,Adds documentation of emo::ji_find to README,0,TRUE,FALSE,FALSE,FALSE,0,0
hadley,emo,37,hmm emoji not available,0,FALSE,FALSE,FALSE,TRUE,0,0
hadley,emo,35,Using emo before plotly in rmd breaks plotly,0,FALSE,FALSE,FALSE,TRUE,0,0
hadley,emo,34,emo package dependencies not showing up in tools::package_dependencies,0,FALSE,FALSE,FALSE,TRUE,0,0
hadley,emo,33,Use in pdf .Rmd,0,FALSE,FALSE,FALSE,TRUE,0,0
hadley,emo,32,Register a emoji completions for :xyz: within quotes,11,TRUE,FALSE,FALSE,FALSE,0,0
hadley,emo,31,some randomness in ji_fisher,0,FALSE,FALSE,FALSE,TRUE,0,0
hadley,emo,30,parser,0,FALSE,FALSE,FALSE,TRUE,0,0
hadley,emo,28,use glue transformers,0,FALSE,FALSE,FALSE,TRUE,0,0
hadley,emo,24,Reconsider imports,3,FALSE,FALSE,FALSE,TRUE,0,0
hadley,emo,21,Add standard emoji codes,10,FALSE,FALSE,FALSE,TRUE,0,0
hadley,emo,19,medal,0,FALSE,FALSE,FALSE,TRUE,0,0
hadley,emo,16,tibble printing of column emoji,1,FALSE,FALSE,FALSE,TRUE,0,0
hadley,emo,15,Add year (and maybe source) in jis. ,0,FALSE,FALSE,FALSE,TRUE,0,0
hadley,emo,13,glumoji,0,FALSE,FALSE,FALSE,TRUE,0,0
hadley,emo,11,document hook,0,FALSE,FALSE,FALSE,TRUE,0,0
hadley,emo,9,Emoji doesn't show up in Rmarkdown upon Shiny-server rendering ,1,FALSE,FALSE,FALSE,TRUE,0,0
hadley,emo,8,A solution for #6,0,TRUE,FALSE,FALSE,FALSE,0,0
hadley,emo,7,Windows woes: emojis render inline but not in blocks,1,FALSE,FALSE,FALSE,TRUE,0,0
hadley,emo,6,ji_find should support regexp,0,FALSE,FALSE,FALSE,TRUE,0,0
hadley,emo,5,emonize,0,FALSE,FALSE,FALSE,TRUE,0,0
hadley,emo,3,Likert emoji scale ,0,FALSE,FALSE,FALSE,TRUE,0,0
hadley,scales,112,Feature request: discrete color scales that don't fail with too few colors,0,FALSE,FALSE,FALSE,TRUE,0,0
hadley,scales,111,ERROR: compilation failed for package ‘scales’,1,FALSE,FALSE,FALSE,TRUE,0,0
hadley,scales,110,scales0.5.0 to R 3.2.1,1,FALSE,FALSE,FALSE,TRUE,0,0
hadley,scales,109,Respect alpha by default in `colour_ramp()`. Closes #108,7,TRUE,FALSE,FALSE,FALSE,0,0
hadley,scales,108,Function colour_ramp() should respect transparency by default,0,FALSE,FALSE,FALSE,TRUE,0,0
hadley,scales,107,feature request: scale_continuous [low priority],0,FALSE,FALSE,FALSE,TRUE,0,0
hadley,scales,106,Pseudo-log transform,0,TRUE,FALSE,FALSE,FALSE,0,0
hadley,scales,105,Provides a default method for rescale and rescale_mid,0,TRUE,FALSE,FALSE,FALSE,0,0
hadley,scales,104,Fix `rescale_mid()` to properly handle NAs.,0,TRUE,FALSE,FALSE,FALSE,0,0
hadley,scales,103,boxcox_trans functions not always valid,0,FALSE,FALSE,FALSE,TRUE,0,0
hadley,scales,102,rescale stopped working with dist objects,2,FALSE,FALSE,FALSE,TRUE,0,0
hadley,scales,100,log-scale Breaks Are Not Always Useful,4,FALSE,FALSE,FALSE,TRUE,0,0
hadley,scales,99,"extended_breaks should expose the ""only.loose"" argument of extended",0,FALSE,FALSE,FALSE,TRUE,0,0
hadley,scales,98,Version 5.0 - Constant Update Available?,2,FALSE,FALSE,FALSE,TRUE,0,0
hadley,scales,97,`percent` gives NaN% for all values in column if any one is NaN,1,FALSE,FALSE,FALSE,TRUE,0,0
hadley,scales,88,date_format does not work correctly on hms objects,2,FALSE,FALSE,TRUE,FALSE,0,0
hadley,scales,87,added label size control to show_col(),1,TRUE,FALSE,FALSE,FALSE,0,0
hadley,scales,85,it would be nice to have date_breaks('0.2 sec'),0,FALSE,FALSE,TRUE,FALSE,0,0
hadley,scales,84,discard clashes with purrr::discard,0,FALSE,FALSE,TRUE,FALSE,0,0
hadley,scales,83,add something like `nice_dollar`,1,FALSE,FALSE,TRUE,FALSE,0,0
hadley,scales,81,hue_pal should preserve referencial transparency,10,TRUE,FALSE,FALSE,FALSE,0,0
hadley,scales,79,Option to set a different decimal mark,1,TRUE,FALSE,FALSE,FALSE,0,0
hadley,scales,76,should percent_format allow variable precision?,1,FALSE,FALSE,TRUE,FALSE,0,0
hadley,scales,69,"""byte"" formatter",5,TRUE,FALSE,FALSE,FALSE,0,0
hadley,scales,59,"tickmark/break calculations with exp_trans, probability_trans fail often",5,FALSE,TRUE,FALSE,FALSE,0,0
hadley,scales,9,breaks for log scales,7,FALSE,FALSE,TRUE,FALSE,0,0
hadley,reshape,85,dcast incorrectly assigns the column names with the argument 'drop = F',0,FALSE,FALSE,FALSE,TRUE,0,0
hadley,reshape,84,New German translation,0,TRUE,FALSE,FALSE,FALSE,0,0
hadley,reshape,83,"use is.object(x) instead of grepl(""OBJ"", .Internal(inspect(x))[1]) in tests",0,FALSE,FALSE,FALSE,TRUE,0,0
hadley,reshape,81,reinvigorate iapply?,0,FALSE,FALSE,FALSE,TRUE,0,0
hadley,reshape,80,"Delete reference to ""grand_row"" and ""grand_col""",0,TRUE,FALSE,FALSE,FALSE,0,0
hadley,reshape,79,acast different column and row sorting in R 3.2.4 and R 3.3.0 under Ubuntu and CentOS,0,FALSE,FALSE,FALSE,TRUE,0,0
hadley,reshape,78,melt.data.frame drops 'dim' attribute for 'value' column (#77),0,TRUE,FALSE,FALSE,FALSE,0,0
hadley,reshape,77,Dimension Mismatch using melt() in reshape2,1,FALSE,FALSE,FALSE,TRUE,0,0
hadley,reshape,76,FR: variable.factor toggle for melt.array,0,FALSE,FALSE,FALSE,TRUE,0,0
hadley,reshape,75,melt behaviour with indexed but non-unique dataframe column names,1,FALSE,FALSE,FALSE,TRUE,0,0
hadley,reshape,74,Handle special attributes,0,TRUE,FALSE,FALSE,FALSE,0,0
hadley,reshape,73,sort_df() and decreasing order?,0,FALSE,FALSE,FALSE,TRUE,0,0
hadley,reshape,68,use plyr from CRAN for testing,0,TRUE,FALSE,FALSE,FALSE,0,0
hadley,reshape,67,dcast formula fails to resolve ... when column names have spaces,0,FALSE,FALSE,FALSE,TRUE,0,0
hadley,reshape,66,Added error checking to melt_check to ensure unique measure.vars,0,TRUE,FALSE,FALSE,FALSE,0,0
hadley,reshape,65,dcast provides incorrect margin totals when subsetting on formula variable,1,FALSE,FALSE,FALSE,TRUE,0,0
hadley,reshape,64,cast.Rd documentation error,0,FALSE,FALSE,FALSE,TRUE,0,0
hadley,reshape,59,Issue with as.is in melt.array,0,FALSE,FALSE,FALSE,TRUE,0,0
hadley,reshape,58,cast calls fun.aggregate initially with an empty object,0,FALSE,FALSE,FALSE,TRUE,0,0
hadley,reshape,57,Allow specifying data type of value column,2,FALSE,FALSE,FALSE,TRUE,0,0
hadley,reshape,54,No non-missing arguments warning when using min or max in reshape2,0,FALSE,FALSE,FALSE,TRUE,0,0
hadley,reshape,52,dcast drops data class,0,FALSE,FALSE,FALSE,TRUE,0,0
hadley,reshape,51,Call type.convert after dcast,2,FALSE,FALSE,FALSE,TRUE,0,0
hadley,reshape,50,melt.data.frame OBJECT bit not set when value is POSIXct ,3,FALSE,FALSE,FALSE,TRUE,0,0
hadley,reshape,49,melt 1.4.0.99 and list columns,3,FALSE,FALSE,FALSE,TRUE,0,0
hadley,reshape,42,Margin label,0,TRUE,FALSE,FALSE,FALSE,0,0
hadley,reshape,30,unintended behavior in melt?,4,FALSE,FALSE,FALSE,TRUE,0,0
hadley,reshape,29,error in dcast when non atomic columns present,3,FALSE,FALSE,FALSE,TRUE,0,0
hadley,reshape,13,Faster colsplit function,1,FALSE,FALSE,FALSE,TRUE,0,0
hadley,sloop,10,Fix default argument for methods_exist,0,TRUE,FALSE,FALSE,FALSE,0,0
hadley,sloop,9,Add links,0,TRUE,FALSE,FALSE,FALSE,0,0
hadley,lazyeval,100,Proofreading picayunia,1,TRUE,FALSE,FALSE,FALSE,0,0
hadley,lazyeval,96,Error message in find_data.default is not helpful,0,FALSE,FALSE,FALSE,TRUE,0,0
hadley,lazyeval,93,fix typo in vignette,1,TRUE,FALSE,FALSE,FALSE,0,0
hadley,lazyeval,92,Port lazy functions to rlang,3,TRUE,FALSE,FALSE,FALSE,0,0
hadley,lazyeval,91,unexpected behaviour with lazyeval::lazy(c),5,FALSE,FALSE,FALSE,TRUE,0,0
hadley,lazyeval,87,support for r 3.0.0,3,TRUE,FALSE,FALSE,FALSE,0,0
hadley,lazyeval,83,Fix typo in vignette,1,TRUE,FALSE,FALSE,FALSE,0,0
hadley,lazyeval,82,Correct a typo,1,TRUE,FALSE,FALSE,FALSE,0,0
hadley,lazyeval,81,Edited new vignette for possible function naming inconsistencies,1,TRUE,FALSE,FALSE,FALSE,0,0
hadley,lazyeval,77,Change in behaviour with primitive functions,1,FALSE,FALSE,FALSE,TRUE,0,0
hadley,lazyeval,76,Should lazy() distinguish between user-defined objects and those in packages?,0,FALSE,FALSE,FALSE,TRUE,0,0
